Domain,Concept (device),Description,,,,Provenance
IfcStructuralAnalysisDomain,Energy conversion device,The distribution flow element IfcEnergyConversionDevice defines the occurrence of a device used to perform energy conversion or heat transfer and typically participates in a flow distribution system. Its type is defined by IfcEnergyConversionDeviceType or its subtypes.,,,,http://www.buildingsmart-tech.org/ifc/IFC4/Add1/html/schema/ifcsharedbldgserviceelements/lexical/ifcenergyconversiondevice.htm
IfcStructuralAnalysisDomain,Energy conversion device type,,,,,http://www.buildingsmart-tech.org/ifc/IFC4/Add1/html/schema/ifcsharedbldgserviceelements/lexical/ifcenergyconversiondevicetype.htm
IfcStructuralAnalysisDomain,Flow controller,"The distribution flow element IfcFlowController defines the occurrence of elements of a distribution system that are used to regulate flow through a distribution system. Examples include dampers, valves, switches, and relays. Its type is defined by IfcFlowControllerType or subtypes.",,,,http://www.buildingsmart-tech.org/ifc/IFC4/Add1/html/schema/ifcsharedbldgserviceelements/lexical/ifcflowcontroller.htm
IfcStructuralAnalysisDomain,Flow controller type,,,,,http://www.buildingsmart-tech.org/ifc/IFC4/Add1/html/schema/ifcsharedbldgserviceelements/lexical/ifcflowcontrollertype.htm
IfcStructuralAnalysisDomain,Flow moving device,"The distribution flow element IfcFlowMovingDevice defines the occurrence of an apparatus used to distribute, circulate or perform conveyance of fluids, including liquids and gases (such as a pump or fan), and typically participates in a flow distribution system. Its type is defined by IfcFlowMovingDeviceType or its subtypes.",,,,http://www.buildingsmart-tech.org/ifc/IFC4/Add1/html/schema/ifcsharedbldgserviceelements/lexical/ifcflowmovingdevice.htm
IfcStructuralAnalysisDomain,Flow moving device type,,,,,http://www.buildingsmart-tech.org/ifc/IFC4/Add1/html/schema/ifcsharedbldgserviceelements/lexical/ifcflowmovingdevicetype.htm
IfcStructuralAnalysisDomain,Flow storage device,The distribution flow element IfcFlowStorageDevice defines the occurrence of a device that participates in a distribution system and is used for temporary storage (such as a tank). Its type is defined by IfcFlowStorageDeviceType or its subtypes.,,,,http://www.buildingsmart-tech.org/ifc/IFC4/Add1/html/schema/ifcsharedbldgserviceelements/lexical/ifcflowstoragedevice.htm
IfcStructuralAnalysisDomain,Flow storage device type,,,,,http://www.buildingsmart-tech.org/ifc/IFC4/Add1/html/schema/ifcsharedbldgserviceelements/lexical/ifcflowstoragedevicetype.htm
IfcStructuralAnalysisDomain,Flow terminal,"The distribution flow element IfcFlowTerminal defines the occurrence of a permanently attached element that acts as a terminus or beginning of a distribution system (such as an air outlet, drain, water closet, or sink). A terminal is typically a point at which a system interfaces with an external environment. Its type is defined by IfcFlowTerminalType or its subtypes.",,,,http://www.buildingsmart-tech.org/ifc/IFC4/Add1/html/schema/ifcsharedbldgserviceelements/lexical/ifcflowterminal.htm
IfcStructuralAnalysisDomain,Flow terminal type,,,,,http://www.buildingsmart-tech.org/ifc/IFC4/Add1/html/schema/ifcsharedbldgserviceelements/lexical/ifcflowterminaltype.htm
IfcStructuralAnalysisDomain,Flow treatment device,"The distribution flow element IfcFlowTreatmentDevice defines the occurrence of a device typically used to remove unwanted matter from a fluid, either liquid or gas, and typically participates in a flow distribution system. Its type is defined by IfcFlowTreatmentDeviceType or its subtypes.",,,,http://www.buildingsmart-tech.org/ifc/IFC4/Add1/html/schema/ifcsharedbldgserviceelements/lexical/ifcflowtreatmentdevice.htm
IfcStructuralAnalysisDomain,Flow treatment device type,,,,,http://www.buildingsmart-tech.org/ifc/IFC4/Add1/html/schema/ifcsharedbldgserviceelements/lexical/ifcflowtreatmentdevicetype.htm
fcSharedBldgElements,What is a shading device?,"Shading devices are purpose built devices to protect from the sunlight, from natural light, or screening them from view. Shading devices can form part of the facade or can be mounted inside the building, they can be fixed or operable.",,,,http://www.buildingsmart-tech.org/ifc/IFC4/Add1/html/schema/ifcsharedbldgelements/lexical/ifcshadingdevice.htm
fcSharedBldgElements,Which shading device types are there?,"JALOUSIE	A blind with adjustable horizontal slats for admitting light and air while excluding direct sun and rain.
SHUTTER	A mechanical devices that limits the passage of light. Often used as a a solid or louvered movable cover for a window.
AWNING	A rooflike shelter of canvas or other material extending over a doorway, from the top of a window, over a deck, or similar, in order to provide protection, as from the sun.",,,,http://www.buildingsmart-tech.org/ifc/IFC4/Add1/html/schema/ifcsharedbldgelements/lexical/ifcshadingdevicetypeenum.htm
IfcProductExtension,What is a transport element?,"A transport element is a generalization of all transport related objects that move people, animals or goods within a building or building complex. The IfcTransportElement defines the occurrence of a transport element, that (if given), is expressed by the IfcTransportElementType. ",,,,http://www.buildingsmart-tech.org/ifc/IFC4/Add1/html/schema/ifcproductextension/lexical/ifctransportelement.htm
IfcProductExtension,Which types of transport element are there?,"ELEVATOR	Elevator or lift being a transport device to move people of good vertically.
ESCALATOR	Escalator being a transport device to move people. It consists of individual linked steps that move up and down on tracks while keeping the threads horizontal.
MOVINGWALKWAY	Moving walkway being a transport device to move people horizontally or on an incline. It is a slow conveyor belt that transports people.
CRANEWAY	A crane way system, normally including the crane rails, fasteners and the crane. It is primarily used to move heavy goods in a factory or other industry buildings.
LIFTINGGEAR	A device used for lifting or lowering heavy goods. It may be manually operated or electrically or pneumatically driven.",,,,http://www.buildingsmart-tech.org/ifc/IFC4/Add1/html/schema/ifcproductextension/lexical/ifctransportelementtypeenum.htm